{
  "kind": 9902,
  "created_at": 1760724793,
  "tags": [
    [
      "a",
      "9902:aaaaaaaaaaaaaaaaaaaaaaaaaaaaaaaaaaaaaaaaaaaaaaaaaaaaaaaaaaaaaaaa:"
    ],
    [
      "p",
      "aaaaaaaaaaaaaaaaaaaaaaaaaaaaaaaaaaaaaaaaaaaaaaaaaaaaaaaaaaaaaaaa"
    ],
    [
      "e",
      "cccccccccccccccccccccccccccccccccccccccccccccccccccccccccccccccc",
      "wss://relay.example.com",
      "reply"
    ]
  ],
  "content": "NIP44:ciphertext-placeholder-for-reservation-response"
}